number,value,datetime_start,datetime_complete,duration,params_base_filters,params_batch_size,params_dropout,params_learning_rate,params_num_layers,params_optimizer,params_weight_decay,user_attrs_parameters,state
0,0.3046,2026-06-05 11:41:08.632348,2026-06-05 11:51:53.227251,0 days 00:10:44.594903,64,64,0.24132282234577357,0.00013668886806542498,2,sgd,2.7222461649436534e-05,77130.0,COMPLETE
1,0.4868,2026-06-05 11:51:53.227783,2026-06-05 11:55:48.922256,0 days 00:03:55.694473,32,128,0.4735369024649948,0.0011078801957339767,4,adam,0.00048686794035961145,391466.0,COMPLETE
2,0.6794,2026-06-05 11:55:48.922668,2026-06-05 12:00:35.668999,0 days 00:04:46.746331,128,128,0.10965424777008215,0.00037372913712767103,3,adam,3.152139841620179e-05,1484938.0,COMPLETE
3,0.2646,2026-06-05 12:00:35.669440,2026-06-05 12:00:59.479665,0 days 00:00:23.810225,16,128,0.407202125258682,0.0017505057241183016,3,adam,4.397066341018203e-05,,PRUNED
4,0.2594,2026-06-05 12:00:59.479934,2026-06-05 12:01:25.169677,0 days 00:00:25.689743,16,64,0.3232717443724937,0.0003267096741134126,3,adam,0.00011722158979927262,,PRUNED
5,0.3828,2026-06-05 12:01:25.169973,2026-06-05 12:02:15.937833,0 days 00:00:50.767860,64,128,0.1654608427979367,0.0005274915603460985,2,adam,5.857415234581233e-05,,PRUNED
6,0.6442,2026-06-05 12:02:15.938151,2026-06-05 12:06:05.569666,0 days 00:03:49.631515,16,128,0.17258619397704977,0.004598399288630771,4,adam,2.2838438226155244e-05,98970.0,COMPLETE
7,0.3432,2026-06-05 12:06:05.570047,2026-06-05 12:06:32.516395,0 days 00:00:26.946348,16,64,0.030764944349826684,0.00021508931874675679,4,sgd,7.926151463062333e-05,,PRUNED
8,0.2988,2026-06-05 12:06:32.516701,2026-06-05 12:06:57.569822,0 days 00:00:25.053121,32,128,0.05524060818968407,0.00011655149789799015,2,adam,5.1064612475242565e-05,,PRUNED
9,0.307,2026-06-05 12:06:57.570138,2026-06-05 12:07:21.305491,0 days 00:00:23.735353,16,128,0.05416819886712976,0.0009165046288134135,3,sgd,0.0004300447013512046,,PRUNED
10,0.4352,2026-06-05 12:07:21.305796,2026-06-05 12:08:22.643430,0 days 00:01:01.337634,128,64,0.3127093013247919,0.009261415115736573,3,sgd,1.2464150228641604e-05,,PRUNED
11,0.8076,2026-06-05 12:08:22.643746,2026-06-05 12:13:34.518329,0 days 00:05:11.874583,128,128,0.1568306406101521,0.004395341451842554,4,adam,1.2204275235965208e-05,6210698.0,COMPLETE
12,0.805,2026-06-05 12:13:34.518721,2026-06-05 12:18:44.366541,0 days 00:05:09.847820,128,128,0.14754793219077725,0.0027021236481053388,4,adam,1.0148382067980415e-05,6210698.0,COMPLETE
13,0.7794,2026-06-05 12:18:44.366972,2026-06-05 12:23:58.441529,0 days 00:05:14.074557,128,128,0.21616733566969748,0.003244768875930013,4,adam,1.0277290703922328e-05,6210698.0,COMPLETE
14,0.8048,2026-06-05 12:23:58.441933,2026-06-05 12:29:14.387582,0 days 00:05:15.945649,128,128,0.1333342061967076,0.0035175172184402415,4,adam,1.5864875050429793e-05,6210698.0,COMPLETE
15,0.4626,2026-06-05 12:29:14.387993,2026-06-05 12:29:48.160361,0 days 00:00:33.772368,128,128,0.2604136095376881,0.00860245899618088,4,adam,1.0267234553707244e-05,,PRUNED
16,0.7948,2026-06-05 12:29:48.160665,2026-06-05 12:35:03.242574,0 days 00:05:15.081909,128,128,0.08362920612053965,0.0019768376190142747,4,adam,2.0377451761288844e-05,6210698.0,COMPLETE
17,0.2978,2026-06-05 12:35:03.243083,2026-06-05 12:35:36.783929,0 days 00:00:33.540846,128,128,0.19023013891577323,0.005474968630889619,4,adam,0.0009921284638274585,,PRUNED
18,0.5166,2026-06-05 12:35:36.784231,2026-06-05 12:36:37.231735,0 days 00:01:00.447504,128,64,0.006551758118135992,0.002101228572741044,3,sgd,0.00011883413829425649,,PRUNED
19,0.4356,2026-06-05 12:36:37.232011,2026-06-05 12:37:03.480042,0 days 00:00:26.248031,32,128,0.28244529601434765,0.001067868810108896,4,adam,1.7037786775738865e-05,,PRUNED
20,0.5566,2026-06-05 12:37:03.480321,2026-06-05 12:37:57.217543,0 days 00:00:53.737222,64,128,0.14013425887620917,0.006327333626825647,4,adam,3.35768312282665e-05,,PRUNED
21,0.7872,2026-06-05 12:37:57.217844,2026-06-05 12:43:10.433077,0 days 00:05:13.215233,128,128,0.1156428200042329,0.003194776018055003,4,adam,1.6040188666101424e-05,6210698.0,COMPLETE
22,0.6768,2026-06-05 12:43:10.433488,2026-06-05 12:45:16.871855,0 days 00:02:06.438367,128,128,0.1337284208161036,0.003379130232413908,4,adam,1.4421491068517863e-05,,PRUNED
23,0.6778,2026-06-05 12:45:16.872181,2026-06-05 12:47:23.133239,0 days 00:02:06.261058,128,128,0.20737530085185724,0.0025924680931500464,4,adam,1.9006122566593235e-05,,PRUNED
24,0.7996,2026-06-05 12:47:23.133552,2026-06-05 12:52:33.947743,0 days 00:05:10.814191,128,128,0.0820520983331727,0.004504029174912323,4,adam,1.276986383802778e-05,6210698.0,COMPLETE
25,0.745,2026-06-05 12:52:33.948082,2026-06-05 12:56:13.747445,0 days 00:03:39.799363,128,128,0.156497722970704,0.0014874354221899092,4,adam,2.5167220270621087e-05,,PRUNED
26,0.4168,2026-06-05 12:56:13.747755,2026-06-05 12:56:45.176099,0 days 00:00:31.428344,128,64,0.22430638055915203,0.007212922206983864,3,sgd,1.608933541260335e-05,,PRUNED
27,0.5632,2026-06-05 12:56:45.176351,2026-06-05 12:57:49.767401,0 days 00:01:04.591050,128,128,0.08925538421574722,0.003766967373945343,4,adam,3.738033637859559e-05,,PRUNED
28,0.4508,2026-06-05 12:57:49.767695,2026-06-05 12:58:17.554078,0 days 00:00:27.786383,64,128,0.3444050794246609,0.0006379341713768904,4,adam,1.1104682351399253e-05,,PRUNED
29,0.3292,2026-06-05 12:58:17.554357,2026-06-05 12:58:44.254321,0 days 00:00:26.699964,32,64,0.19131679353577066,0.002434372042872809,3,sgd,2.4896688347367746e-05,,PRUNED
30,0.4866,2026-06-05 12:58:44.254614,2026-06-05 12:59:12.204919,0 days 00:00:27.950305,64,128,0.26380517109064056,0.0014092371319711478,4,adam,2.7677546527039058e-05,,PRUNED
31,0.7992,2026-06-05 12:59:12.205216,2026-06-05 13:04:22.843080,0 days 00:05:10.637864,128,128,0.08621362412408742,0.004679688553821555,4,adam,1.40442131139186e-05,6210698.0,COMPLETE
32,0.6678,2026-06-05 13:04:22.843468,2026-06-05 13:06:29.621104,0 days 00:02:06.777636,128,128,0.11452384008518736,0.004276380888807584,4,adam,1.2863076599043047e-05,,PRUNED
33,0.7972,2026-06-05 13:06:29.621410,2026-06-05 13:11:42.770407,0 days 00:05:13.148997,128,128,0.04887933494619892,0.0057648978512923115,4,adam,1.902074679792564e-05,6210698.0,COMPLETE
34,0.4854,2026-06-05 13:11:42.770810,2026-06-05 13:12:16.542897,0 days 00:00:33.772087,128,128,0.13558816315552713,0.0029406654512894683,4,adam,1.2798076633551793e-05,,PRUNED
35,0.5424,2026-06-05 13:12:16.543174,2026-06-05 13:13:20.471382,0 days 00:01:03.928208,128,128,0.08692959345062223,0.007476161569181154,4,adam,1.0065372078306677e-05,,PRUNED
36,0.4854,2026-06-05 13:13:20.471685,2026-06-05 13:13:46.675519,0 days 00:00:26.203834,32,128,0.1695178300472073,0.001763641815027085,4,adam,3.3120809652366915e-05,,PRUNED
37,0.4204,2026-06-05 13:13:46.675849,2026-06-05 13:14:19.580286,0 days 00:00:32.904437,128,128,0.4470434696729131,0.0050726723039966285,4,adam,2.3040214163846315e-05,,PRUNED
38,0.3784,2026-06-05 13:14:19.580567,2026-06-05 13:14:51.454205,0 days 00:00:31.873638,128,64,0.008557493615182737,0.002213128300088092,3,adam,0.00022157660571174364,,PRUNED
39,0.3054,2026-06-05 13:14:51.454516,2026-06-05 13:15:15.099078,0 days 00:00:23.644562,16,128,0.1486453460065787,0.004080344690202917,2,adam,4.29979266822946e-05,,PRUNED
40,0.339,2026-06-05 13:15:15.099376,2026-06-05 13:15:42.610737,0 days 00:00:27.511361,64,128,0.23668587073163294,0.0015198338946381769,4,sgd,1.835304947107902e-05,,PRUNED
41,0.7452,2026-06-05 13:15:42.611013,2026-06-05 13:18:52.100751,0 days 00:03:09.489738,128,128,0.07625662461910165,0.004680515785471412,4,adam,1.3100161483871708e-05,,PRUNED
42,0.6398,2026-06-05 13:18:52.101039,2026-06-05 13:20:28.745973,0 days 00:01:36.644934,128,128,0.1184018035668783,0.002746545553873213,4,adam,1.4812565789237042e-05,,PRUNED
43,0.5444,2026-06-05 13:20:28.746267,2026-06-05 13:21:33.727124,0 days 00:01:04.980857,128,128,0.09759071410767163,0.00981910626472668,4,adam,1.4578539813979778e-05,,PRUNED
44,0.588,2026-06-05 13:21:33.727417,2026-06-05 13:22:39.081994,0 days 00:01:05.354577,128,128,0.0637573695042587,0.006601253977025172,4,adam,2.777399944320175e-05,,PRUNED
45,0.5338,2026-06-05 13:22:39.082266,2026-06-05 13:23:27.230481,0 days 00:00:48.148215,16,128,0.03984095301330177,0.0038843007674266186,4,adam,1.0008428174606347e-05,,PRUNED
46,0.5842,2026-06-05 13:23:27.230775,2026-06-05 13:24:32.724415,0 days 00:01:05.493640,128,128,0.186961365496674,0.00016903844896517462,4,adam,2.1969737856876932e-05,,PRUNED
47,0.7956,2026-06-05 13:24:32.724713,2026-06-05 13:30:13.568372,0 days 00:05:40.843659,128,64,0.023654529754389697,0.005298974412260296,4,adam,1.2166526791679313e-05,6210698.0,COMPLETE
48,0.3454,2026-06-05 13:30:13.568730,2026-06-05 13:30:39.559576,0 days 00:00:25.990846,32,128,0.10925640691759168,0.0035447696885810274,3,sgd,1.7932771640588947e-05,,PRUNED
49,0.4668,2026-06-05 13:30:39.559893,2026-06-05 13:31:12.967394,0 days 00:00:33.407501,128,128,0.07010321177945401,0.0045670536996068375,4,adam,1.4750260125522345e-05,,PRUNED
